{
  "description": "File-native coder harness. Every component (config, prompt, tools, hooks, shared resources, and evals) is reviewable and version-controlled.",
  "metadata": {
    "tags": [
      "coding",
      "software-engineering",
      "testing",
      "file-native"
    ]
  },
  "name": "coder",
  "schema_version": 2
}
