{
  "description": "File-native dependency security auditor harness. Detects, parses, and checks project dependencies for security and license issues.",
  "metadata": {
    "tags": [
      "security",
      "dependencies",
      "file-native"
    ]
  },
  "name": "dep-doctor",
  "schema_version": 2
}
