{
  "description": "Fully-portable twin of dep_doctor: all 7 audit tools (detect_dep_files, parse_deps, check_package, check_license_compat, find_alternatives, think, done) are served by the bundled MCP stdio server (_mcp/tools_server.py), the RegistryGuard permission policy is a kind: lep hook, and compaction is the host-provided runtime service. Zero Python-pinned components — runs on any conforming loader (Rust/Go/TS). find_alternatives reaches the host LLM through the Model Gateway (MGP: the loader exports LOOPLET_LLM_SOCKET and the MCP server connects to it), so it returns real LLM-suggested alternatives — full parity with the in-process original; if no gateway/backend is reachable it degrades to the same empty result the original returns when ctx.llm is None.",
  "metadata": {
    "tags": [
      "security",
      "dependencies",
      "portable"
    ]
  },
  "name": "dep_doctor_portable",
  "schema_version": 2
}
